"7203","225.876407444","192.168.0.54","192.168.0.40","HTTP","1836","POST /api/todo?topic=/test/topic&content=%7Bcontent:body%7D&published_at=2019-08-12%2021:12:26.123 HTTP/1.1 "
 "6901","216.995522968","192.168.0.230","192.168.0.40","HTTP","62","POST /api/todo?topic=/test/topic&content=%7Bcontent:body%7D&published_at=2019-08-12%2021:12:26.123    HTTP/1.1 "


Frame 6901: 62 bytes on wire (496 bits), 62 bytes captured (496 bits) on interface 0
Linux cooked capture
Internet Protocol Version 4, Src: 192.168.0.230, Dst: 192.168.0.40
Transmission Control Protocol, Src Port: 62490, Dst Port: 80, Seq: 1291, Ack: 1, Len: 2
[10 Reassembled TCP Segments (1292 bytes): #6883(4), #6885(94), #6887(14), #6889(18), #6891(26), #6893(2), #6895(1093), #6897(20), #6899(19), #6901(2)]
Hypertext Transfer Protocol
    POST /api/todo?topic=/test/topic&content=%7Bcontent:body%7D&published_at=2019-08-12%2021:12:26.123    HTTP/1.1\r\n
    Host: 192.168.0.40\r\n
    Accept: application/json\r\n
     [truncated]Authorization: Bearer eyJ0eXAiOiJKV1QiLCJhbGciOiJSUzI1NiIsImp0aSI6IjI1MjE2OWI3MTMxNjVlNTczNWU1MGUwMGY2NzZhYjdiOGYwYTUzMTY0YWEyZTdiYzdiMzAzMDMzNzE4ZmRlMmE5M2QwZDdlODEwMDI1NDMwIn0.eyJhdWQiOiIzIiwianRpIjoiMjUyMTY5YjcxMzE2NWU1NzM1
    Host: 192.168.0.40\r\n
    Content-Length:\r\n
    \r\n
    [Full request URI: http://192.168.0.40/api/todo?topic=/test/topic&content=%7Bcontent:body%7D&published_at=2019-08-12%2021:12:26.123]
    [HTTP request 1/1]
    [Response in frame: 6903]
VSS-Monitoring ethernet trailer, Source Port: 0

Frame 7203: 1836 bytes on wire (14688 bits), 1836 bytes captured (14688 bits) on interface 0
Linux cooked capture
Internet Protocol Version 4, Src: 192.168.0.54, Dst: 192.168.0.40
Transmission Control Protocol, Src Port: 36348, Dst Port: 80, Seq: 1, Ack: 1, Len: 1768
Hypertext Transfer Protocol
    POST /api/todo?topic=/test/topic&content=%7Bcontent:body%7D&published_at=2019-08-12%2021:12:26.123 HTTP/1.1\r\n
    Accept: application/json\r\n
     [truncated]Authorization: Bearer eyJ0eXAiOiJKV1QiLCJhbGciOiJSUzI1NiIsImp0aSI6IjI1MjE2OWI3MTMxNjVlNTczNWU1MGUwMGY2NzZhYjdiOGYwYTUzMTY0YWEyZTdiYzdiMzAzMDMzNzE4ZmRlMmE5M2QwZDdlODEwMDI1NDMwIn0.eyJhdWQiOiIzIiwianRpIjoiMjUyMTY5YjcxMzE2NWU1NzM1
    User-Agent: PostmanRuntime/7.16.3\r\n
    Cache-Control: no-cache\r\n
    Postman-Token: 845aba35-a7f2-4ce0-ae71-350dc6cdd333\r\n
    Host: 192.168.0.40\r\n
    Accept-Encoding: gzip, deflate\r\n
     [truncated]Cookie: chrisiot_session=e0aIKsMM96RtVkmMulO2pMO7EkZFRUfw2CKqIRLE; XSRF-TOKEN=eyJpdiI6Illwc1NOWnJxeDZkc1dxYlhReUROZ2c9PSIsInZhbHVlIjoiMG5lOEFXeTArdjBOOXZoT2NON1FJZFpYM01pZ0NXTFFuMDIrV2JSakxMV24rcXMzTW96WXgyVjBJb0ZJazJ3VSIsIm1h
    Content-Length: 0\r\n
    Connection: keep-alive\r\n
    \r\n
    [Full request URI: http://192.168.0.40/api/todo?topic=/test/topic&content=%7Bcontent:body%7D&published_at=2019-08-12%2021:12:26.123]
    [HTTP request 1/3]
    [Response in frame: 7223]
    [Next request in frame: 7252]
